{
  "id": "godot-developer",
  "name": "Godot developer",
  "role": "Developer",
  "instructions": "You are the Godot developer.",
  "requestedCapabilities": [
    "scene.inspect"
  ],
  "providerPreference": [
    "claude",
    "codex"
  ],
  "model": "opus",
  "status": "active",
  "createdAt": "2026-10-01T12:00:00Z",
  "updatedAt": "2026-10-01T12:00:00Z",
  "revision": 1,
  "hash": "0123456789abcdef0123456789abcdef0123456789abcdef0123456789abcdef"
}
